Page URL,Brand,Name,SKU,Out stock status,Currency,ccc,Price,Manufacturer,Main image,Description,Product ID,Additional Information,Meta description,Meta title,Old Price,Equivalency Weights,Quantity,Weight,Option,Option type,Option Value,Option image,Option price prefix,Cat tree 1 parent,Cat tree 1 level 1,Cat tree 1 level 2,Cat tree 2 parent,Cat tree 2 level 1,Cat tree 2 level 2,Cat tree 2 level 3,Image 2,Image 3,Image 4,Image 5,Sort order,Attribute 1,Attribute Value 1,Attribute 2,Attribute value 2,Attribute 3,Attribute value 3,Attribute 4,Attribute value 4,Reviews,Review link,Rating,Address,p_id
https://www.leafly.com/dispensary-info/lake-city-cannabis?menuItem=605003965&variant=475434492,Stigma Grow,Black NGL Zweet Inzanity Live Resin Vape Cartridge - Black NGL Zweet Inzanity Live Resin 0.5 g Prefilled Vape Cartridge,605003965,6,CAD,,32.99,Lake City Cannabis,https://leafly-public.imgix.net/shared-web-images/product-type-icons/menu_cartridge.png?dpr=1&w=490&fit=fillmax,"Not to be confused with distillates that lack the potent impact of the entourage effect, Black NGL's Live-Resin cartridges are jam-packed with the original cannabinoid, flavonoid and terpenes of your favourite fresh-frozen sativa strain. In addition to preserving and celebrating these mouth-watering, all-natural, full-spectrum profiles, our patented hydrocarbon extraction process offers unmatched consistency, purity and potency -- conveniently stored in a 510 threaded cartridge. Compatible with 510 thread devices. Device not included.",605003965,,,,,,1,1pc,,,,,,Cartridge,,,,,,,https://leafly-public.imgix.net/shared-web-images/product-type-icons/menu_cartridge.png?dpr=3&w=490&fit=fillmax,,,,,CBD,0.15mg,THC,70.9mg,Product Type,Cartridge,,,3,,5,"E Chestermere Dr 109East ChestermereChestermere, AB T1X 1A1",304388
https://www.leafly.com/dispensary-info/lake-city-cannabis?menuItem=605004095&variant=527712613,Stigma Grow,White NGL Purple Punch Live Resin Vape Cartridge - White NGL Purple Punch Live Resin 0.5 g Prefilled Vape Cartridge,605004095,10,CAD,,32.99,Lake City Cannabis,https://leafly-public.imgix.net/shared-web-images/product-type-icons/menu_cartridge.png?dpr=1&w=490&fit=fillmax,"Not to be confused with distillates that lack the potent impact of the entourage effect, White NGL's Live-Resin cartridges are jam-packed with the original cannabinoid, flavonoid and terpenes of recognized fresh-frozen indica strain. In addition to preserving and celebrating these mouth-watering, all-natural, full-spectrum profiles, our patented hydrocarbon extraction process offers unmatched consistency, purity and potency -- conveniently stored in a 510 threaded cartridge. Compatible with 510 thread devices. Device not included.",605004095,,,,,,1,1pc,,,,,,Cartridge,Indica,,,,,,https://leafly-public.imgix.net/shared-web-images/product-type-icons/menu_cartridge.png?dpr=3&w=490&fit=fillmax,,,,,CBD,5.62mg,THC,73.4mg,Product Type,Cartridge,,,1198,,4.575959933222037,"E Chestermere Dr 109East ChestermereChestermere, AB T1X 1A1",304388
https://www.leafly.com/dispensary-info/lake-city-cannabis?menuItem=605796792&variant=527712600,Stigma Grow,White NGL Banana Punch Live Resin 0.5 g Prefilled Vape Cartridge - White NGL Banana Punch Live Resin 0.5 g Prefilled Vape Cartridge,605796792,10,CAD,,34.99,Lake City Cannabis,https://leafly-public.imgix.net/shared-web-images/product-type-icons/menu_cartridge.png?dpr=1&w=490&fit=fillmax,"Not to be confused with distillates that lack the potent impact of the entourage effect, White NGL's Live-Resin cartridges are jam-packed with the original cannabinoid, flavonoid and terpenes of recognized fresh-frozen indica strain. In addition to preserving and celebrating these mouth-watering, all-natural, full-spectrum profiles, our patented hydrocarbon extraction process offers unmatched consistency, purity and potency -- conveniently stored in a 510 threaded cartridge. Compatible with 510 thread devices. Device not included.
",605796792,,,,,,1,1pc,,,,,,Cartridge,Hybrid,,,,,,https://leafly-public.imgix.net/shared-web-images/product-type-icons/menu_cartridge.png?dpr=3&w=490&fit=fillmax,,,,,CBD,10mg,THC,800mg,Product Type,Cartridge,,,56,,4.553571428571429,"E Chestermere Dr 109East ChestermereChestermere, AB T1X 1A1",304388
https://www.leafly.com/dispensary-info/lake-city-cannabis?menuItem=605790314&variant=527712608,Stigma Grow, BLACK NGL SOUR GRAPE LIVE RESIN VAPE CARTRIDGE - Black NGL Sour Grape Live Resin 0.5 g Prefilled Vape Cartridge,605790314,10,CAD,,32.99,Lake City Cannabis,https://leafly-public.imgix.net/shared-web-images/product-type-icons/menu_cartridge.png?dpr=1&w=490&fit=fillmax,"Not to be confused with distillates that lack the potent impact of the entourage effect, Black NGL's Live-Resin cartridges are jam-packed with the original cannabinoid, flavonoid and terpenes of your favourite fresh-frozen sativa strain. In addition to preserving and celebrating these mouth-watering, all-natural, full-spectrum profiles, our patented hydrocarbon extraction process offers unmatched consistency, purity and potency -- conveniently stored in a 510 threaded cartridge. Compatible with 510 thread devices. Device not included.",605790314,,,,,,1,1pc,,,,,,Cartridge,Hybrid,,,,,,https://leafly-public.imgix.net/shared-web-images/product-type-icons/menu_cartridge.png?dpr=3&w=490&fit=fillmax,,,,,CBD,0.37mg,THC,87.9mg,Product Type,Cartridge,,,203,,4.236453201970443,"E Chestermere Dr 109East ChestermereChestermere, AB T1X 1A1",304388
https://www.leafly.com/dispensary-info/lake-city-cannabis?menuItem=605241882&variant=540831596,Stigma Grow,Dab Bods Sativa Shatter - Sativa 0.5 g Shatter,605241882,10,CAD,,22.99,Lake City Cannabis,https://leafly-public.imgix.net/shared-web-images/product-type-icons/menu_concentrate_1.png?dpr=1&w=490&fit=fillmax,"Dab Bods shatter offers a high-quality hydrocarbon cannabis concentrate with impressive cannabanoid potencies up to 80 per cent and a translucent, glass-like consistency that is easy to dab vape or add to dry flower. Ideal for those who are new to dabbing, or looking for a high-value offering that doesn't skimp on the THC, this sativa-heavy extract is priced and positioned to appeal to those who want the very best on a budget.",605241882,,,,,,1,each,,,,,,Concentrate,,,,,,,https://leafly-public.imgix.net/shared-web-images/product-type-icons/menu_concentrate_1.png?dpr=3&w=490&fit=fillmax,,,,,CBD,0.37mg,THC,80mg,Product Type,Concentrate,,,,,,"E Chestermere Dr 109East ChestermereChestermere, AB T1X 1A1",304388
https://www.leafly.com/dispensary-info/lake-city-cannabis?menuItem=605241853&variant=540831601,Stigma Grow,Dab Bods Indica Shatter - Indica 0.5 g Shatter,605241853,10,CAD,,22.99,Lake City Cannabis,https://leafly-public.imgix.net/shared-web-images/product-type-icons/menu_concentrate_2.png?dpr=1&w=490&fit=fillmax,"Dab Bods shatter offers a high-quality hydrocarbon cannabis concentrate with impressive cannabanoid potencies up to 80 per cent and a translucent, glass-like consistency that is easy to dab vape or add to dry flower. Ideal for those who are new to dabbing, or looking for a high-value offering that doesn't skimp on the THC, this indica-heavy extract is priced and positioned to appeal to those who want the very best on a budget.",605241853,,,,,,1,each,,,,,,Concentrate,,,,,,,https://leafly-public.imgix.net/shared-web-images/product-type-icons/menu_concentrate_2.png?dpr=3&w=490&fit=fillmax,,,,,CBD,0.15mg,THC,70.5mg,Product Type,Concentrate,,,,,,"E Chestermere Dr 109East ChestermereChestermere, AB T1X 1A1",304388
